{
  "corpus_id": "quality-corpus",
  "members": [
    {
      "family": "line-end-hyphenation",
      "format": "docx",
      "member_id": "line-end-hyphenation",
      "source": "../../refinement/v0.3/line-end-hyphenation.docx"
    },
    {
      "family": "repeated-margin",
      "format": "pdf",
      "member_id": "repeated-margin",
      "source": "../../diagnosis/v0.2/repeated-margin.pdf"
    },
    {
      "family": "short-note",
      "format": "md",
      "member_id": "short-note",
      "source": "../../diagnosis/v0.2/short-note.md"
    },
    {
      "family": "structural-traps",
      "format": "md",
      "member_id": "structural-traps",
      "source": "../../diagnosis/v0.2/structural-traps.md"
    },
    {
      "family": "whitespace-cleanup",
      "format": "md",
      "member_id": "whitespace-cleanup",
      "source": "../../refinement/v0.3/whitespace-cleanup.md"
    }
  ],
  "schema_version": "tcw.corpus-spec/v0.4",
  "title": "Evidence-based diagnosis and refinement quality cases"
}
